id,email_address,priority,title,content,archive_ind,created_dt,is_complete
1,john.doe@example.com,H,Finish project report,Complete the quarterly project report for the team meeting,N,2023-09-15 10:00:00,0
2,john.doe@example.com,M,Buy groceries,Pick up milk, eggs, and bread from the store,N,2023-09-16 14:30:00,1
3,jane.smith@example.com,L,Call mom,Remember to call mom for her birthday,N,2023-09-17 09:00:00,0
4,jane.smith@example.com,H,Prepare presentation,Create slides for the client presentation next week,N,2023-09-18 11:00:00,0
5,alice.johnson@example.com,M,Gym session,Attend evening gym session - focus on cardio,N,2023-09-19 18:00:00,1
6,alice.johnson@example.com,H,Submit expense report,Compile and submit last month's expense report,N,2023-09-20 13:00:00,0